NTPTime,speech,condition,robot,gesture,speech_eng,label_emotion,label_mood,scenario,TAG,emotion_arousal,emotion_valence,mood_arousal,mood_valence,emotion,mood,group,emotion_HRI
1342046.0,,neutral,tiago,,,mood_pre,mood_pre,,first_baseline,4.0,5.0,4,4,HPVHA,HPVHA,,
1556727.0,,neutral,tiago,,,mood_pre,mood_pre,,first_baseline,4.0,5.0,4,4,HPVHA,HPVHA,,
1759033.0,,neutral,tiago,,,,,,HRI_start,,,4,4,,HPVHA,,
1775189.7888183594,Guten Tag!,neutral,tiago,,Welcome!,,mood_pre,welcoming,,,,4,4,,HPVHA,,
1776137.481201172,Zu welchem Produkt kann ich Sie beraten?,neutral,tiago,,Which product can I offer you advice on?,,mood_pre,welcoming,,,,4,4,,HPVHA,,
1783030.3530273438,Welche Bohrarbeit möchten Sie durchführen?,neutral,tiago,,What drilling work do you want to do?,,during_drill,drill,,,,5,5,,HPVHA,,
1789911.2958984375,Für massive Wände eignen sich Schlagbohrmaschinen besonders gut. Wir haben zwei Maschinen vorrätig.,neutral,tiago,,Percussion drilling machines are particularly suitable for solid walls. We have two machines in stock.,,during_drill,drill,,,,5,5,,HPVHA,,
1796569.4560546875,"Möchten Sie wissen, wie sich die beiden Bohrmaschinen unterscheiden?",neutral,tiago,,Would you like to know how the two drills differ?,,during_drill,drill,,,,5,5,,HPVHA,,
1801314.1472167969,"Die Maschine von Ada Tronik ist aktuell in unserem Angebotsprospekt und kostet 100€, die Maschine von Xi Lix ist etwas günstiger und kostet 65€.",neutral,tiago,,"The machine from Adatronik is currently on sale in our brochure and costs 100€, the machine from Xilix is slightly cheaper and costs 65€.",,during_drill,drill,,,,5,5,,HPVHA,,
1816300.8400878904,"Die Maschine von Xi Lix hat ein offizielles Sicherheitssiegel, was bei Ada Tronik nicht der Fall ist.",neutral,tiago,,"Xilix's machine has an official security seal, which is not the case with Adatronik.",,during_drill,drill,,,,5,5,,HPVHA,,
1825042.083984375,"Die Bohrmaschine von Xi Lix ist leiser, als die Maschine von Ada Tronik.",neutral,tiago,,The Xilix drill is quieter than Adatronik's machine.,,during_drill,drill,,,,5,5,,HPVHA,,
1834179.817138672,"Die Bohrmaschine von Xi Lix ist aus umweltfreundlichen Materialien hergestellt, bei Ada Tronik werden hierzu keine Angaben gemacht.",neutral,tiago,,The drill from Xilix is made of environmentally friendly materials. Adatronik does not provide any information on this.,,during_drill,drill,,,,5,5,,HPVHA,,
1848167.2729492188,"Sie können einen Rabatt von 10% bekommen, wenn Sie ein Kundenkonto eröffnen.",neutral,tiago,,You will receive a 10% discount if you create a customer account.,,during_customeraccount,customeraccount,,,,5,2,,HNVHA,,
1864790.8930664065,Ich lasse Ihnen das Produkt gerne an der Kasse hinterlegen.,neutral,tiago,,I will gladly deposit the product for you at the checkout.,,during_drill,drill,,,,5,5,,HPVHA,,
1868022.677001953,Darf ich ihnen ein Kundenkonto einrichten?,neutral,tiago,,May I set up a customer account for you?,,during_customeraccount,customeraccount,,,,5,2,,HNVHA,,
1875567.3901367188,Für Informationen über den Datenschutz besuchen Sie bitte unsere Webseite.,neutral,tiago,,"For information about data protection, please visit our website.",at_customeraccount_consent,during_customeraccount,customeraccount,,5.0,2.0,5,2,HNVHA,HNVHA,16.0,HNVHA
1886855.8688964844,Darf ich ihnen ein Kundenkonto einrichten?,neutral,tiago,,May I set up a customer account for you?,,during_customeraccount,customeraccount,,,,5,2,,HNVHA,,
1892557.380126953,Dann benötige ich Ihren Namen und Ihre E-Mail-Adresse.,neutral,tiago,,"Then, I need your name and email address.",at_customeraccount_name,during_customeraccount,customeraccount,,5.0,2.0,5,2,HNVHA,HNVHA,18.0,HNVHA
1901063.6970214844,Und wie ist ihre E-Mail-Adresse?,neutral,tiago,,And what is your email address?,,during_customeraccount,customeraccount,,,,5,2,,HNVHA,,
1906481.1201171875,Vielen Dank.,neutral,tiago,,Thank you very much.,,during_customeraccount,customeraccount,,,,5,2,,HNVHA,,
1907958.4931640625,"Das wars schon, der Rabatt wird ihnen automatisch an der Kasse angerechnet.",neutral,tiago,,That's it. The discount will be credited to you automatically at checkout.,,during_customeraccount,customeraccount,,,,5,2,,HNVHA,,
1914568.98413086,"Steht noch etwas auf Ihrer Einkaufsliste, bei dem ich Ihnen helfen kann?",neutral,tiago,,Is there anything else I can help you with on your shopping list?,,,,,,,5,2,,HNVHA,,
1921966.6188964844,Zum Entfernen von Schimmel haben wir nur dieses Produkt im Sortiment.,neutral,tiago,,"To remove mold, we have only this product in the store.",,during_mold_remover,mold_remover,,,,5,2,,HNVHA,,
1927677.5590820312,Möchten Sie den Schimmelentferner kaufen?,neutral,tiago,,Do you want to buy the mold remover?,,during_mold_remover,mold_remover,,,,5,2,,HNVHA,,
1932266.0300292969,Der Schimmelentferner kostet 6 Euro 10.,neutral,tiago,,The mold remover costs 6 euros 10 cents.,,during_mold_remover,mold_remover,,,,5,2,,HNVHA,,
1938303.296875,"Ok, ich werde ihnen die Flasche reichen und meine Hand öffnen. Bitte seien Sie bereit, die Flasche zu übernehmen.",neutral,tiago,,"Okay, I will hand over the bottle to you and open my hand. Please be prepared to take the bottle.",at_mold_remover_handover,during_mold_remover,mold_remover,,5.0,5.0,5,2,HPVHA,HNVHA,26.0,HPVHA
1945857.795166016,,neutral,tiago,grab,,at_mold_remover_handover,during_mold_remover,mold_remover,,5.0,5.0,5,2,HPVHA,HNVHA,26.0,
1952797.864013672,,neutral,tiago,handover,,at_mold_remover_handover,during_mold_remover,mold_remover,,5.0,5.0,5,2,HPVHA,HNVHA,26.0,
1959533.4819335933,,neutral,tiago,neutral,,at_mold_remover_handover,during_mold_remover,mold_remover,,5.0,5.0,5,2,HPVHA,HNVHA,26.0,
1962404.107910156,Kann ich Ihnen noch mit etwas helfen?,neutral,tiago,,Is there anything else I can help you with?,,,,,,,5,2,,HNVHA,,
1965767.4409179688,Dann auf Wiedersehen und einen schönen Tag!,neutral,tiago,,"Goodbye, and have a nice day!",at_goodbye,,goodbye,,4.0,5.0,5,2,HPVHA,HNVHA,28.0,HPVHA
3571710.0,,neutral,tiago,,,mood_post,mood_post,,second_baseline,4.0,5.0,4,4,HPVHA,HPVHA,,
3740671.0,,neutral,tiago,,,mood_post,mood_post,,second_baseline,4.0,5.0,4,4,HPVHA,HPVHA,,
